key,text
npc.all.system.name,※※※
npc.all.ancients.name,古人
dlg.all.empty_checked.001,坦白来说，这个横线只是代表一个空的槽位。
dlg.all.empty_checked.002,如果你真的想查看关于“空”的信息，我会引用古人的一句话。
dlg.all.empty_checked.003,此中有真意，欲辨已忘言。
dlg.all.empty_dropped.001,这个槽位是空的，所以你无法丢掉任何东西。
dlg.all.empty_dropped.002,本来无一物，何处惹尘埃？

dlg.all.default_dropped,你丢弃了它。
dlg.all.default_checked,没有描述。
dlg.all.default_full,你拿的东西太多了。
npc.all.unknown.name,？？？

dlg.all.StG44_checked.001,这是一把StG44，现代步枪的鼻祖。
dlg.all.StG44_checked.002,不知道为什么，它看起来非常大。
dlg.all.StG44_dropped.001,你丢掉了突击步枪。可能是因为它太重了。

dlg.all.admin's_pistol_checked.001,一把让人费解的小手枪。之前属于管理员。
dlg.all.admin's_pistol_dropped.001,因为某些原因，你丢掉了管理员的手枪。

dlg.all.missile_launcher_checked.001,导弹的发射器。简单且强大。
dlg.all.missile_launcher_dropped.001,你丢掉了简单且强大的导弹发射器。

dlg.all.slime_rifle_checked.001,一把绿色的步枪，可以让人飞得很远。
dlg.all.slime_rifle_dropped.001,你丢掉了弹射步枪。

dlg.all.maze_medal_checked.001,一枚奖章。绶带上写着：“可以征服混沌的人”。
dlg.all.maze_medal_checked.002,如果你乐意的话，它可以在商店换取50G。
dlg.all.maze_medal_dropped.001,你丢掉了迷宫支配者奖章。
dlg.all.maze_medal_dropped.002,看起来你并不是很热衷于荣誉。

dlg.all.health_potion_checked.001,平平无奇的治疗药水。一次回复20HP。
dlg.all.health_potion_dropped.001,你丢掉了治疗药水。

dlg.all.key_checked.001,一把钥匙，用于打开对应的门。
dlg.all.key_dropped.001,某种力量阻止着你丢掉这把钥匙。


npc.lab.system.name,※※※
npc.lab.unknown.name,？？？
npc.lab.admin.name,管理员
npc.lab.guide.name,向导

dlg.lab.button.001,这里有一个按钮。
dlg.lab.button.002,你按下了它。
dlg.lab.button.003,电流嗡嗡作响，不知道在哪里的喇叭开始播放一段声音：
dlg.lab.button.004,“你好，欢迎你来玩我的游戏。你可以到右边的房间里来找我。”

dlg.lab.button.005,你按下了这个按钮。
dlg.lab.button.006,没有任何变化。

dlg.lab.chest1.001,箱子是空的。
dlg.lab.chest1.002,好吧，这种事有时就是会发生。
dlg.lab.chest1.003,你再次检查了这个箱子。
dlg.lab.chest1.004,你发现这个箱子里真的什么也没有。
dlg.lab.chest1.005,你没忍住又检查了一遍这个箱子。
dlg.lab.chest1.006,令人惊奇的是，这个箱子里真的什么也没有！


dlg.lab.chest2.001,你试图打开这个箱子。有点吃力。
dlg.lab.chest2.002,不过箱子终于打开了，你获得了一块专属奖章。
dlg.lab.chest2.003,这个箱子里已经没有东西了。


dlg.lab.admin.001,你好，玩家。
dlg.lab.admin.002,这个地方是我搭建的，你可以叫我管理员。
dlg.lab.admin.003,我为你准备了一段探险旅程。
dlg.lab.admin.004,不过我还并没有做完。实际上，我遇到了一些非常棘手的困难。而且我目前还没有什么头绪来解决它们。
dlg.lab.admin.005,但是总之，如果你要出发，向右边走就可以了。

dlg.lab.admin.006,不过你刚刚去了哪里吗？我等了你非常久。。。

dlg.lab.admin.007,你最好过段时间再来找我，我现在需要认真思考这些代码逻辑。
dlg.lab.admin.008,你看到管理员正在焦急地等待AI的回复。

dlg.lab.admin.009,哦，那是迷宫支配者勋章吗？
dlg.lab.admin.010,我还以为没人能找得到的，那你很厉害了。

dlg.lab.admin.011,你好，玩家。
dlg.lab.admin.012,这个地方是我搭建的，你可以叫我管理员。
dlg.lab.admin.013,我为你准备了一段探险旅程。
dlg.lab.admin.014,不过我还并没有做完。实际上，我遇到了一些非常棘手的困难。而且我目前还没有什么头绪来解决它们。
dlg.lab.admin.015,但是总之，如果你要出发，向右边走就可以了。
dlg.lab.admin.016,话说，你现在拿的是迷宫支配者勋章吗？
dlg.lab.admin.017,我还以为没人能找得到的，那你很有实力了。

dlg.lab.admin.018,你好。
dlg.lab.admin.019,你为什么回来了？


dlg.lab.locked_door.001,这扇门没有锁，但是被某种力量封印了，你打不开。
dlg.lab.locked_door.002,这扇门被锁住了，你需要持有对应的钥匙才能打开。


dlg.lab.guide.001,嗨！你是玩家，对吧。
dlg.lab.guide.002,我是这里的向导，我来介绍一下这边的项目。
dlg.lab.guide.003,。 。 。 。 。 。 。 。 。 。 。 。 。 。 。 。 。 。 。 。
dlg.lab.guide.004,好吧实际上我是第一天来上班，我也不知道这边有什么。
dlg.lab.guide.005,不过反正你是玩家，应该可以随便存读档，自己慢慢摸索也可以。 。 。 。
dlg.lab.guide.006,然后管理员让我把这个钥匙给你，应该能用来开右下方的门。


dlg.lab.turret.001,你打开了会发射弹球的箱子。
dlg.lab.turret.002,你获得了一把弹射步枪。
dlg.lab.turret.003,会发射弹球的箱子不再会发射弹球了。
dlg.lab.turret.004,一只不会发射弹球的箱子。

dlg.lab.admin.101,你好。
dlg.lab.admin.102,这里是你的重生点。
dlg.lab.admin.103,现在你可以继续探险了。

dlg.lab.admin.104,你好。
dlg.lab.admin.105,你又重生了。
dlg.lab.admin.106,现在你可以继续探险了。

dlg.lab.admin.107,稍等，我还在看我的代码。。。

npc.shop.djgun.name,DJGun
dlg.shop.djgun.001,"大家吼！
今天来电大家想买的冻吸
来来来来来..."
dlg.shop.djgun.002,"你吼！
欢迎光临...
电警棍桑店！"
dlg.shop.djgun.003,你米有足够哒钱钱，
dlg.shop.djgun.004,蟹蟹惠顾！
dlg.shop.djgun.005,你嘟背包满噜。
no.item,no.item

talkop.shop.djgun.001,打招呼
talkop.shop.djgun.002,关于你是谁...
talkop.shop.djgun.003,关于米米火箭...
talkop.shop.djgun.004,关于商店...